{
  "$schema": "https://json-schema.org/draft/2020-12/schema",
  "$id": "https://ubcrocket.dev/schemas/messages/registry.schema.json",
  "title": "UBC Rocket Message Registry",
  "description": "Single source of truth for all structured I/O between firmware, ground station, jetson, and tools. Codegen produces C headers (packed structs + auto-generated .proto + nanopb output), the Python decoder library, the routing table, and the host annotation tables. Hand-assigned IDs (module_id, msg_id, cmd_id, channel_id, error code) are stable on the wire — never renumber.",
  "type": "object",
  "additionalProperties": false,
  "required": ["version", "channels", "modules"],
  "properties": {
    "$schema": {
      "type": "string",
      "description": "Optional editor hint pointing at this meta-schema. Ignored by codegen."
    },
    "version": {
      "type": "integer",
      "minimum": 1,
      "description": "Registry format version. Bump only when the meta-schema itself changes shape."
    },
    "channels": {
      "type": "object",
      "description": "Transport channels available to the publish path. Routing entries in messages reference these by name. Adding a transport means adding an entry here — no codegen code changes.",
      "patternProperties": {
        "^[a-z][a-z0-9_]*$": { "$ref": "#/$defs/channel" }
      },
      "additionalProperties": false,
      "minProperties": 1
    },
    "types": {
      "type": "object",
      "description": "User-defined composite types. Reference from any field as 'type:<typename>'. Codegen emits packed sub-structs for Class A, nanopb sub-messages for Class B. Types may reference other types; cycles are rejected by codegen.",
      "patternProperties": {
        "^[a-z][a-z0-9_]*$": { "$ref": "#/$defs/user_type" }
      },
      "additionalProperties": false
    },
    "modules": {
      "type": "object",
      "description": "Modules group related messages/commands/errors. Module names form C identifier prefixes (e.g. servo -> SERVO_*).",
      "patternProperties": {
        "^[a-z][a-z0-9_]*$": { "$ref": "#/$defs/module" }
      },
      "additionalProperties": false,
      "minProperties": 1
    }
  },
  "$defs": {
    "channel": {
      "type": "object",
      "additionalProperties": false,
      "required": ["channel_id", "transport", "framing", "max_wire_bps", "description"],
      "properties": {
        "channel_id": {
          "type": "integer",
          "minimum": 0,
          "maximum": 255,
          "description": "Hand-assigned, stable on the wire. Used in commands like set_route."
        },
        "transport": {
          "enum": ["sd_record", "uart", "udp"],
          "description": "Transport family. Determines which sink the routing layer fans out to. sd_record = appended to SD log; uart = framed over a UART; udp = packetised over UDP."
        },
        "framing": {
          "enum": ["none", "cobs", "slip"],
          "description": "Wire framing. 'none' for SD (records are length-prefixed inside the log format) and UDP (packet boundaries are intrinsic). 'cobs' for UART streams."
        },
        "max_wire_bps": {
          "type": "number",
          "minimum": 1,
          "description": "Channel bandwidth budget in bits/sec. The build-time linter sums max_rate_hz × wire_size across all messages routed here and fails the build if it exceeds this."
        },
        "transport_config": {
          "type": "object",
          "description": "Transport-specific config. Schema is validated by codegen (uart needs uart_id; udp needs port; sd_record needs nothing).",
          "additionalProperties": true
        },
        "description": { "type": "string", "minLength": 1 }
      }
    },

    "user_type": {
      "type": "object",
      "additionalProperties": false,
      "required": ["description", "fields"],
      "properties": {
        "description": { "type": "string", "minLength": 1 },
        "fields": {
          "type": "array",
          "description": "Field order is wire order. Same evolution rules as messages — only append.",
          "items": { "$ref": "#/$defs/field" },
          "minItems": 1
        }
      }
    },

    "module": {
      "type": "object",
      "additionalProperties": false,
      "required": ["module_id", "description"],
      "properties": {
        "module_id": {
          "type": "integer",
          "minimum": 0,
          "maximum": 255,
          "description": "Hand-assigned, stable on the wire. 0 reserved for 'system'."
        },
        "description": { "type": "string", "minLength": 1 },
        "messages": {
          "type": "object",
          "patternProperties": { "^[a-z][a-z0-9_]*$": { "$ref": "#/$defs/message" } },
          "additionalProperties": false
        },
        "commands": {
          "type": "object",
          "patternProperties": { "^[a-z][a-z0-9_]*$": { "$ref": "#/$defs/command" } },
          "additionalProperties": false
        },
        "errors": {
          "type": "object",
          "patternProperties": { "^[a-z][a-z0-9_]*$": { "$ref": "#/$defs/error" } },
          "additionalProperties": false
        }
      }
    },

    "message": {
      "type": "object",
      "additionalProperties": false,
      "required": ["msg_id", "class", "description", "fields", "routing"],
      "properties": {
        "msg_id": {
          "type": "integer",
          "minimum": 1,
          "maximum": 65535,
          "description": "Hand-assigned within the module."
        },
        "class": {
          "enum": ["A", "B"],
          "description": "A = packed record, fixed schema, hot path. B = nanopb envelope, flexible schema, sporadic."
        },
        "description": { "type": "string", "minLength": 1 },
        "fields": {
          "type": "array",
          "items": { "$ref": "#/$defs/field" },
          "minItems": 1
        },
        "routing": { "$ref": "#/$defs/routing" }
      }
    },

    "command": {
      "type": "object",
      "additionalProperties": false,
      "required": ["cmd_id", "description", "request", "response"],
      "properties": {
        "cmd_id": {
          "type": "integer",
          "minimum": 1,
          "maximum": 65535
        },
        "description": { "type": "string", "minLength": 1 },
        "request": {
          "type": "array",
          "description": "Request payload fields. Always Class B (nanopb).",
          "items": { "$ref": "#/$defs/field" }
        },
        "response": {
          "type": "object",
          "additionalProperties": false,
          "required": ["streaming", "fields"],
          "properties": {
            "streaming": {
              "type": "boolean",
              "description": "If true, the command emits multiple response messages until a terminating one. Used for long-running operations (cal sessions, self-tests with progress)."
            },
            "fields": {
              "type": "array",
              "items": { "$ref": "#/$defs/field" }
            }
          }
        }
      }
    },

    "error": {
      "type": "object",
      "additionalProperties": false,
      "required": ["code", "description"],
      "properties": {
        "code": {
          "type": "integer",
          "minimum": 1,
          "maximum": 65535
        },
        "description": {
          "type": "string",
          "minLength": 1,
          "description": "Human-readable explanation. Rendered by ground tooling when an error appears in a log or on the console. The ONLY place these strings live — firmware never sends them on the wire."
        }
      }
    },

    "field": {
      "type": "object",
      "additionalProperties": false,
      "required": ["name", "type", "description"],
      "properties": {
        "name": {
          "type": "string",
          "pattern": "^[a-z][a-z0-9_]*$"
        },
        "type": {
          "type": "string",
          "description": "Primitive (u8/u16/u32/u64/i8/i16/i32/i64/f32/f64/bool), Class B only (string/bytes), user type ref ('type:vec3_m'), enum ref to a specific error ('enum:servo.out_of_range', encodes as u16), or enum ref to a whole module namespace ('enum:servo.errors', encodes as u16, accepts any code in that module). Optional fixed-array suffix: 'f32[3]', 'type:vec3_m[4]'.",
          "pattern": "^((u8|u16|u32|u64|i8|i16|i32|i64|f32|f64|bool|string|bytes)|(type:[a-z_][a-z0-9_]*)|(enum:[a-z_][a-z0-9_]*\\.[a-z_][a-z0-9_]*))(\\[[1-9][0-9]*\\])?$"
        },
        "units": {
          "type": "string",
          "description": "SI or domain unit (e.g. 'm/s', 'rad', 'deg_C', 'us'). Required for physical quantities."
        },
        "description": { "type": "string", "minLength": 1 }
      }
    },

    "routing": {
      "type": "object",
      "additionalProperties": false,
      "description": "Keys must match channel names declared in top-level 'channels'. Codegen rejects routing entries that reference unknown channels. Channels not listed are disabled by default.",
      "patternProperties": {
        "^[a-z][a-z0-9_]*$": { "$ref": "#/$defs/channel_route" }
      }
    },

    "channel_route": {
      "type": "object",
      "additionalProperties": false,
      "required": ["enabled"],
      "properties": {
        "enabled": {
          "type": "boolean",
          "description": "Default state at boot. Runtime can toggle via 'system.set_route' until 'system.lock_routes' is called or auto-lock-on-arm fires."
        },
        "max_rate_hz": {
          "type": "number",
          "minimum": 0,
          "description": "Class A only. Token-bucket rate limit at the publish path. The build-time bus-budget linter consumes this."
        }
      }
    }
  }
}
